{
  "version": "v1",
  "defaults": {
    "mode": "human_review",
    "success_threshold": 0.8,
    "min_samples": 5
  },
  "intents": {
    "urn:core:summary:summary_to_file": {
      "mode": "human_review",
      "success_threshold": 0.8,
      "min_samples": 3
    }
  },
  "fail_action": "block"
}
